user2,359,359,समस्तीपुर,भाषाप्रभू,भारत के बिहार राज्य का एक शहर समस्तीपुर,भाषेवर प्रभुत्व असणारा आज संम,275.47,3.7,30,1030,69,26,11,29,0
user2,361,361,सीमा बंधन,सीमांकन,सीमा को अंकित करने का कार्य बँटवारे के ,सीमा निश्चितीचे कार्य भौगोलि,294.0,3.72,49,1132,84,30,22,48,1
user2,363,363,रक्तप्रवाह,कॅरामल,रक्त का प्रवाह हृदय का रक्तप्रवाह रुकत,"दूध, तूप, भाजलेली साखर इत्यादींपासून बनवल",223.03,5.73,30,452,63,29,15,29,0
user2,365,365,पौर्णमासी,पौर्णिमा,"चान्द्र मास के शुक्ल पक्ष की अंतिम तिथि, ज",ज्या तिथीस चंद्रबिंब सोळाही कलांनी युक्,279.24,3.68,76,1272,54,44,56,75,1
user2,367,367,बध्य,वध्य,मार डालने योग्य मेरी दृष्टि में प्रत्य,मारून टाकण्यास योग्य असा प्रत,258.42,3.53,31,894,117,20,14,30,1
user2,369,369,खंभ,ताणा बाणा,"पत्थर, लकड़ी, आदि का बना गोल या चौकोर ऊँचा ",विणीचे उभे आडवे धागे किंवा सूत,243.0,4.55,28,390,106,43,14,27,0
user2,371,371,सब कुछ,राहू,"पूरा का पूरा काम, वस्तु आदि यानि जिसमें सब",नवग्रहातील आठवा ग्रह तुमच्या,257.55,3.78,51,933,41,38,20,51,0
user2,373,373,कैलिफोर्निया,ग्रंथी,अमरीका का एक राज्य जो प्रशांत महासागर के ,"शीख गुरुद्वारांमधील संत, जो ग्रंथ साहेबम",248.78,7.03,9,410,31,41,1,8,0
user2,375,375,गुणग्राहक,गुणग्राही,गुणों या गुणियों का आदर करनेवाला व्यक्ति,गुणांची पारख करणारा तूच खरा म,229.33,5.37,27,372,63,28,15,26,1
user2,377,377,ठिकाना,ठिकाण,निश्चित या निर्दिष्ट स्थान  घर में कोई ,निश्चित अथवा निर्देशित स्थान,221.14,3.85,72,510,21,26,38,71,1
user2,379,379,उद्यमशील,उद्योगशील,जो प्रयत्न या कोशिश में लगा हुआ हो या प्रय,प्रयत्न करत राहणारा उद्योगशी,277.32,4.51,25,554,101,29,15,24,1
user2,381,381,जनप्रियता,लोकप्रियता,लोकप्रिय होने की अवस्था या भाव हिन्दी क,लोकप्रिय असण्याची अवस्था कॉम,246.03,4.89,29,435,44,23,22,28,1
user2,383,383,विटभूत,अद्रोही,एक दैत्य विटभूत का वर्णन महाभारत में मि,कधईही द्रोह न करणारा अद्रोही ,248.16,4.21,63,629,82,19,21,62,0
user2,385,385,एकमुश्त,चोळमंडल,एक बार में या एक साथ उसने सारा देन एकमुश,एक प्राचीन देश सध्याचे तंजाऊर,258.02,3.78,52,521,38,23,23,52,0
user2,387,387,भीम,व्यवस्था,युधिष्ठिर के छोटे भाई जो अर्जुन से बड़े थ,एखादे विशिष्ट काम करायला समर्थ अशा लोकां,206.33,4.47,15,448,42,30,4,15,0
user2,389,389,दिवसकर,दिवाकर,हमारे सौर जगत का वह सबसे बड़ा और ज्वलंत ता,दिवसाचा प्रकाश निर्माण करणारा आणि पृथ्व,177.12,4.17,33,475,23,47,19,32,1
user2,391,391,मालिक,मालक,वह जिसे किसी वस्तु आदि पर पूरे और सब प्रका,एखाद्या गोष्टीविषयी सर्व किंवा महत्त्वा,215.23,3.78,31,447,42,36,14,30,1
user2,393,393,युद्धबंदी,युद्धकैदी,युद्ध के समय बन्दी बनाए हुए विपक्षी सैनिक,युद्धात अटक केलेले सैनिक भारत,281.71,3.82,31,570,89,29,12,30,1
user2,395,395,परजा,प्रजा,किसी राजा के अधीन या उसके राज्य में रहने व,एखाद्या राजा वा शासनाच्या आधिपत्याखाली ,244.02,3.56,41,442,82,37,9,41,1
user2,397,397,पाकुड़,अननक्वॉडियम,भारत के झारखंड राज्य का एक शहर पाकुड़ क,एक किरणोत्सर्गी रासायनिक तत्त्व,202.65,5.02,17,611,32,30,12,16,0
user2,399,399,इंध,इंधन,वे पदार्थ जिनके जलने से ऊर्जा प्राप्त होत,ज्या पदार्थाचा वापर करून ऊर्जा मिळवता ये,227.85,4.3,20,420,133,40,6,19,1
