user2,179,179,गुल्लाला,मित्रराष्ट्र,एक प्रकार का लाल फूल पहले लोग गुल्लाला ,संकटसमयी मित्रभावाने एकमेकांना मदत देणा,257.56,4.11,25,449,58,29,22,24,0
user2,181,181,कृति,लाजाळू,"चित्र, ग्रंथ, वास्तु आदि के रूप में बनाई हु",थोड्या स्पर्शाने पाने मिटणारी वनस्पती,255.45,3.87,42,661,68,33,37,41,0
user2,183,183,नोंकदार,टोकदार,जिसमें नोक हो भाला एक नोंकदार हथियार है,तीक्ष्ण टोक असलेला त्याला टोक,248.93,4.75,15,629,136,17,10,14,1
user2,185,185,पौराण,पौराणिक,पुराण संबंधी या पुराण का दादी हमें पौरा,पुराणातील वा पुराणासंबंधी त्,258.83,6.66,12,532,147,22,11,12,1
user2,187,187,क्षत विक्षत,महालक्ष्मी,कटी पिटी अवस्था में इधर इधर फैला हुआ वह ,नारायणाची एक शक्ती महालक्ष्म,229.59,3.95,27,422,50,28,21,26,0
user2,189,189,विटामिन सी,कोश,"एक प्रकार का विटामिन जो नीबू, संतरा, आमला आ",ज्यात काही साठवले जाते अशी गोष्ट,211.52,5.43,21,387,42,43,18,20,0
user2,191,191,प्लेट,सेनापती,पृथ्वी की तह की कठोर परत जिसे माना जाता है,सैन्याचा मुख्य नायक कार्तिके,238.15,3.58,27,465,99,33,22,26,0
user2,193,193,छाल,दिवस,"पेड़ों के धड़,शाखा आदि का ऊपरी आवरण किस",दिवसाच्या चोवीस तासातून काम करण्याची वे,240.97,4.26,33,561,57,33,25,32,0
user2,195,195,आड़ा,आडवा,जो क्षितिज के समान अन्तर पर हो आड़ा रेख,जो क्षितीजाच्या सरळ पातळीवर असलेला,241.14,3.71,58,500,71,42,49,57,1
user2,197,197,आगे,साडेसाती,आगे की ओर स्थिति पंक्ति में राम मेरे आग,एका विशिष्ट वेळेपर्यंत राहणारी शनि ग्रह,214.36,3.08,33,444,49,36,19,32,0
user2,199,199,श्रद्धेय,गोळीबार,जिसके प्रति श्रद्धा करना उचित हो ईश्वर,मारण्यासाठी बंदूक इत्यादीतून गोळी झाडण्,368.22,1.19,9,830,23,24,3,9,0
user2,201,201,पाटलोपल,शरण्य,एक प्रकार की मणि पाटलोपल सफेदी लिए लाल ,शरण आलेल्यांचे रक्षण करणारा श,249.09,4.54,33,463,95,28,24,32,0
user2,203,203,त्रैलोक्य,त्रिलोक,"स्वर्ग, पृथ्वी और पाताल   ये तीनों लोक भग","त्रैलोक्य,त्रिलोक,""  स्वर्ग, पृथ्वी और पाता"" ",247.38,4.38,32,716,104,45,28,31,1
user2,205,205,स्वादयुक्त,काच,जिसमें स्वाद हो या जो स्वाद से भरा हुआ हो,"वाळू, सोडा, पोटॅश, चुना, अल्युमिना, शिशाचे ",283.71,3.69,35,1290,49,44,28,34,0
user2,207,207,नगरघड़ी,बलरामपूर,वह टावर जिसमें एक या एक से अधिक बड़ी घड़िय,भारताच्या उत्तर प्रदेश राज्यातील एक जिल,237.32,4.4,19,475,130,49,16,19,0
user2,209,209,परिभ्रमण,परिक्रमण,किसी स्थान आदि के चारों ओर घूमने की क्रिय,एखाद्या वस्तू किंवा जागेच्या सभोवती फिर,217.71,5.76,14,320,27,35,11,14,1
user2,211,211,लौंग,लवंग,एक झाड़ की कली जिसे सुखाकर मसाले और दवा के,लवंग नावाच्या झाडाच्या वाळविलेल्या कळ्य,244.21,5.08,24,564,88,48,20,23,1
user2,213,213,सांभर,सांबर,एक प्रकार का हिरन जो विशेषकर दक्षिण एशिया,हरणासारखा जनावर सांबराचे शिं,258.15,2.95,33,960,35,31,21,32,1
user2,215,215,नाराच,नंदूरबार,एक प्रकार का बाण जो लोहे का बना होता है श,महाराष्ट्रतील एक जिल्हा नंदू,285.24,4.05,21,1117,65,30,13,20,0
user2,217,217,अपरिहार्य,अनिवार्य,"जिसे लेना,रखना या मानना बिलकुल आवश्यक हो",टाळता न येणारा प्रश्नपत्रिके,249.8,3.48,41,594,51,21,25,40,1
user2,219,219,बिक्री,विक्रय,मूल्य लेकर किसी को कोई चीज़ देने की क्रिय,मोल घेऊन एखादी गोष्ट देण्याची क्रिया,220.95,4.98,19,371,107,30,15,18,1
user2,221,221,बोहरा,पसंत,एक जाति  बोहरा जाति दक्षिण भारत में पाई ,एखाद्या विशेष गुणामुळे आवडणारी गोष्ट,203.11,5.47,27,438,32,28,18,26,0
user2,223,223,बतिया,यष्टी,थोड़े दिनों का लगा हुआ कच्चा छोटा फल लौ,क्रिक्रेटच्या खेळात वापरल्या जाणाऱ्या,216.17,5.43,24,445,69,36,21,24,0
user2,225,225,केशरी,केसरी,अंजना के पति और हनुमान के पिता केशरी सु,मारोतीचे वडील केसरी हा वानरां,257.15,3.54,20,501,105,22,11,19,1
user2,227,227,भोजनालय,परिशीलन,वह स्थान जहाँ पका हुआ भोजन मिले हमनें श,"मनापासूनचा अभ्यास, जबर व्यासंग",242.42,1.86,19,681,102,24,11,19,0
user2,229,229,सहल,सहज,जल्दी हो सकने वाला या जिसमें कठिनाई न हो,करण्यास किंवा होण्यास कठीण नसलेले,276.08,4.49,77,1085,25,29,64,76,1
user2,231,231,सोमपिती,महिषासुर,रगड़े हुए चंदन को रखने का बर्तन संतजी र,पुराणांत दुर्गादेवीने ज्याचा वध केला तो ,238.29,5.06,21,428,124,33,11,21,0
user2,233,233,सर्वभक्षी,सर्वभोजी,जो सबकुछ खाता हो  मानव एक सर्वभक्षी प्र,सर्व प्रकारचे अन्न ज्यास चालते असा,264.58,5.91,33,808,78,23,22,32,1
user2,235,235,कुहू,तांबडा समुद्र,अमावस्या की रात तांत्रिक कुहू को तंत्र,हिंदी महासागराचा एक फाटा तांब,262.21,4.87,77,586,48,25,60,77,0
user2,237,237,कक्षा प्रबंध,काटा,कक्षा की व्यवस्था का काम कक्षा नायक कक्,माशाच्या शरीरातील हाड मासा खा,267.09,3.22,68,965,69,24,54,67,0
user2,239,239,गुल अजायब,प्रतिविन्ध्य,एक फूलदार पौधा  माली बाग में गुल अजायब ल,द्रौपदीच्या पाच मुलांपैकी एक,296.33,3.37,40,760,78,21,20,39,0
user2,241,241,गुप्तकालीन,ध्वजदंड,गुप्तकाल से संबंधित या गुप्तकाल का सार,झेंड्याची काठी ध्वजदंडावर झे,326.08,5.2,26,2230,54,26,15,25,0
user2,243,243,अशब्द,भूचर प्राणी,शब्दों का अभाव अशब्द की स्थिति में मूक ,जमिनीवर राहणारा प्राणी गाय ही,215.74,4.37,19,492,56,24,12,19,0
user2,245,245,ब्रह्मर्षि,परिवहन मंत्रालय,वह ऋषि जो ब्राह्मण कुल में उत्पन्न हुआ हो,परिवहन मंत्र्याच्या निर्देशनात काम करणा,192.67,4.97,21,326,47,30,15,20,0
user2,247,247,प्रियतम,प्रियकर,वह पुरुष जो प्रेम करे मीता अपने प्रियतम,प्रेम करणारी पुरुष व्यक्ती ति,260.96,4.14,50,728,64,25,41,49,1
user2,249,249,वरदाता,वरदायक,वर देने वाला वरदाता ईश्वर हमें बिना माँ,वर देणारा वरदायक ईश्वर आपल्या,203.22,3.82,23,361,37,25,16,22,1
user2,251,251,शंकर ताल,चंदीगड,संगीत में एक ताल शंकर ताल में ग्यारह मा,भारताचे एक केंद्रशासित प्रदेश,222.13,3.83,23,406,81,23,18,22,0
user2,253,253,मित्र,वडा,प्रायः समान अवस्था का वह व्यक्ति जिससे स्,उकडलेल्या बटाट्याच्या सुक्या भाजीचे गोळ,269.27,6.66,11,400,58,49,11,10,0
user2,255,255,क्यूबाई,माचा,क्यूबा से संबंधित या क्यूबा का  क्यूबाई,"चार खांबांवर उभारलेली, शेताच्या राखणीसा",237.9,4.98,21,553,36,28,14,20,0
user2,257,257,परिश्रम,परिश्रम,ऐसा काम जिसे करते करते शरीर में शिथिलता आ,शरीराला वा मनास थकवा येईल असे काम,193.63,5.55,19,461,33,32,17,18,1
user2,259,259,मुरब्बा,मुरांबा,वह मिठाई जो फलों आदि को चीनी आदि की चाशनी म,साखरेच्या पाकात मुरवलेला आंबा इत्यादी,216.51,5.57,35,444,37,36,34,35,1
user2,261,261,क्रूरता,क्रूरपणा,"निर्दय होने की अवस्था, गुण या भाव सुरेश ",कठोर किंवा निष्ठुर असण्याची अवस्थआ किंव,230.94,5.45,35,483,29,34,31,34,1
user2,263,263,ठेस,ठेच,ठेस का लाक्षणिक प्रयोग उसके व्यवहार से,लाक्षणिक अर्थाने ठेच तिच्या व,229.42,5.4,24,519,28,27,18,24,1
user2,265,265,अनमिख,अनिमिष,बिना पलक झपकाए या टकटकी बाँधे हुए वह आग,न मिटणारा ती अनिमेष दृष्टीने ,240.54,3.85,41,682,77,26,28,40,1
user2,267,267,खिरनी,वाघनख,एक प्रकार का ऊँचा और छतनार सदाबहार वृक्ष,वाघाची नखे सोन्यात मढविलेला गळ्यात घाला,293.33,14.87,3,375,133,34,3,3,0
user2,269,269,पुत्ररहित,पुत्रहीन,जिसे पुत्र न हो पुरुष हमारा पुत्ररहित ,मुलगा नसलेला माझा पुत्रहीन शे,239.5,6.25,28,511,30,22,24,27,1
user2,271,271,चुनाव क्षेत्र,कपिंजल,वह स्थान या क्षेत्र जिसे अपना प्रतिनिधि च,एक ऋषी कपिंजलचे वर्णन पुराणां,251.32,4.45,25,532,44,31,18,24,0
user2,273,273,व्यावसायी,व्यापारी,व्यापार करने वाला व्यक्ति मोहन एक कुशल,व्यापार करणारी व्यक्ती रुपया,230.96,6.19,25,491,29,19,20,24,1
user2,275,275,बपतिस्मा,कोटा,ईसाइयों का एक धर्म कार्य बपतिस्मा के द्,एक द्रविड भाषा दक्षिण भारतात ,303.74,4.74,19,1215,78,31,15,19,0
user2,277,277,सिपाहगिरी,शिपाईगिरी,सिपाही का काम श्याम सिपाहीगिरी करता है,शिपायाचे काम त्याचे काका लष्क,235.13,4.98,47,512,29,16,30,46,1
user2,279,279,गँजेड़ी,अनुषंग,वह जो नशे के लिए प्रायः गाँजे का सेवन करता,एखाद्या गोष्टीपासून आपोआप दुसरी गोष्ट घ,234.13,3.87,38,470,46,39,28,37,0
user2,281,281,निरुत्साही,अनुत्साही,जिसमें उत्साह या स्फूर्ति न हो निरुत्स,उत्साह किंवा स्फूर्ती नसलेला,255.1,3.95,40,548,126,27,32,39,1
user2,283,283,अनुपात,मार्गदर्शन,दो मात्राओं के सापेक्ष परिमाण एक और पाँ,मार्ग दाखवण्याची क्रिया शिक्,241.42,3.85,57,498,86,27,49,56,0
user2,285,285,असह,वयोगट,"जो अपने उग्रता,कठोरता,अनौचित्य आदि के कार",साधारणतः समान वय असेलल्या लोकांचा समूह,248.85,4.41,48,552,38,36,36,48,0
user2,287,287,हौली,हिरण्यधनू,देशी शराब बनने या बिकने की जगह धनिया का ,एक पौराणिक निषाद एकलव्य हा हि,226.66,2.98,29,544,41,30,21,29,0
user2,289,289,दोस्ताना,दोस्तीचा,मित्रता से भरा हुआ या मित्र जैसा श्याम ,मैत्री असलेला किंवा मित्रासारखा,222.46,4.04,28,397,101,31,24,27,1
user2,291,291,टांगना,टांगणे,नीचे से किसी ऊँचे आधार पर इस प्रकार टिकान,वस्तूची एक बाजू एका ठिकाणी अडकवून वस्तू ल,222.84,3.62,31,430,13,46,28,30,1
user2,293,293,महानारायण,कोरडवाहू जमीन,एक उपनिषद्  महानारायण उपनिषद् अथर्व वे,विहिर किंवा पाटबंधार्याच्या पाण्याविरह,229.76,5.51,17,508,58,30,13,16,0
user2,295,295,बिद्ध,विद्ध,"छिदा, भेदा या बेधा हुआ  शिकारी बिद्ध शिक",हल्ल्यात वेध घेतला गेल्याने घायाळ झालेल,240.98,3.61,50,579,76,23,40,49,1
user2,297,297,स्थावर,स्थिर,जो चल न सके या जिसमें गति न हो वनस्पतिया,हलवण्यास अशक्य असलेला घर ही स,280.57,4.05,81,668,25,26,65,80,1
user2,299,299,फ़ारस,डौल,एक प्राचीन देश जो अफ़गानिस्तान के पश्चिम,हालचालीतील सौंदर्य तिचा डौल प,223.5,4.16,42,591,70,30,32,41,0
user2,301,301,इरा,धरा,सौर जगत का वह ग्रह जिस पर हम लोग निवास करते,ज्यावर जीवसृष्टी आहे असा सूर्यमालेमधील ,240.83,3.78,52,552,28,32,44,51,1
user2,303,303,विपुत्रा,निपुत्रीका,जिसे पुत्र न हो स्त्री उन्होंने अपनी व,ज्यास पुत्र नाही स्त्री त्या,246.44,5.85,16,437,148,29,16,15,1
user2,305,305,चलना,नाशवंत,चलनी की तरह का लोहे का वह बड़ा कलछा जिससे उ,नाश पावणारा नाशवंत वस्तुंना थ,252.85,4.35,106,589,75,39,96,105,0
user2,307,307,मैनफर,दादागिरी,मंझोले आकार का एक काँटेदार वृक्ष मैनफर,उगीचच एखाद्याशी भांडण किंवा मारामारी कर,260.4,2.95,35,832,51,33,23,34,0
user2,309,309,अस्तुरा,वस्त्रा,बाल मूँड़ने का छुरा बाल बनाते समय नाई न,केस काढण्याचे एक शस्त्र गिर्ह,248.3,2.97,63,636,64,30,46,62,1
user2,311,311,कैप्सूल,अवतरण,एक प्रकार की दवा की गोली जिसमें एक सम्पुट ,अभियुक्त ग्रंथकारांच्या ग्रंथांतून आपल,219.57,4.54,63,473,63,46,51,62,0
user2,313,313,अनुमति,दामोदर,कोई काम करने से पहले उसके संबंध में बड़ों ,बिहार आणि पश्चिमबंगालातून वाहणारी गंगेच,232.5,4.61,34,451,51,52,38,33,0
user2,315,315,फेनदार,फेसयुक्त,जिसमें फेन या झाग हो  समुद्र में फेनदार ,फेस असलेला समुद्रात फेसयुक्त,242.09,5.02,22,447,108,21,20,21,1
user2,317,317,कसर,कसूर,किसी चीज या बात का ऐसा अभाव या कमी जिसकी पू,एखादी वस्तू किंवा गोष्टीतील अभाव किंवा क,267.2,4.53,60,873,46,47,51,59,1
user2,319,319,जलपीपल,दीक्षा,पीपल की जाति का एक बहुत छोटा पेड़ जो अगतिम,उपनयन संस्काराच्या अंतर्गत एक विधी ज्या,256.2,3.61,46,800,74,47,32,45,0
user2,321,321,मलझन,विसराळू,एक प्रकार की बेल मलझन को बागों में लगाय,विसरण्याचा स्वभाव असलेला राम,281.62,3.06,34,1963,24,21,23,33,0
user2,323,323,रास,कारले,एक मात्रिक छंद रास के प्रत्येक चरण में ,"रास,कारले,""  एक मात्रिक छंद रास के प्रत्य"" ",192.64,2.72,28,590,79,68,24,27,0
user2,325,325,वानप्रस्थी,वानप्रस्थाश्रमी,जो वानप्रस्थ आश्रम में प्रवेश कर गया हो,वानप्रस्थाश्रमात प्रवेश केलेला,267.51,3.08,45,1254,22,32,34,45,1
user2,327,327,लखपति,गोत्रप्रवर्तक,जिसके पास लाखों रूपयों की सम्पत्ति हो श,ज्याच्या नावाने गोत्रची उत्पत्ती झाली आ,235.95,3.71,43,591,62,26,34,42,0
user2,329,329,प्रार्थी,प्रार्थक,प्रार्थना या आवेदन करनेवाला आज प्रार्,प्रार्थना करणारा आम्ही प्रार,253.26,3.66,31,688,24,23,21,30,1
user2,331,331,चुपचाप,गुपचूप,दूसरों की नजर बचाकर श्याम चुपचाप से आया,एखाद्याची हळूच नजर चूकवून मी ,264.42,3.18,33,480,73,26,30,32,1
user2,333,333,सीधे,सुरत,बिना मध्यस्थ के मैंने रुपयों के लिए सीध,भारतातील गुजरात राज्यातील एक जिल्हा,264.95,3.27,22,871,32,26,17,21,0
user2,335,335,साक्षर,पीलू,जिसे अक्षरों को पढ़ना लिखना आता हो हमार,एका काटेरी झाडाचे फळ पीलू हे ल,256.06,3.36,33,921,125,35,27,32,0
user2,337,337,ग्रसित,ग्रस्त,पकड़ा हुआ रोग ग्रसित होते हुए भी वह इला,तावडीत सापडलेला बरीच वर्षे तो,207.05,4.05,43,379,46,24,34,43,1
user2,339,339,अनामीज़,अनामी,अनाम से संबंधित या अनाम का  यह एक अनामीज,अनाम ह्या प्रांताचा वा ह्या प्रांताशी सं,231.71,3.05,24,521,94,25,15,23,1
user2,341,341,मानसिक रोग,मायक्रोनेशिया,"तनाव, घबराहट आदि की स्थिति उनके मानसिक ",पश्चिमी प्रशांत महासागरात स्थित द्वीपसम,291.93,4.49,29,664,79,25,19,28,0
user2,343,343,पाया,बडबड,"पलंग, चौकी, आदि में नीचे के वे छोटे खंभे जि",काहीतरी वेड्यासारखे असे निरर्थक भाषण,224.07,2.76,44,789,29,39,40,44,0
user2,345,345,परिभाषा,संथाली,किसी शब्द या पद का अर्थ या भाव प्रकट करने व,संथाल जमातीतील लोकांची भाषा स,243.19,4.75,52,526,54,32,41,51,0
user2,347,347,विधेयक,सीमोल्लंघन,किसी विधान या क़ानून का वह पूर्व या प्रस्,सीमारेषेचे केलेले अतिक्रमण भ,242.0,3.72,59,512,55,46,62,58,0
user2,349,349,ओकोलेहाओ,आदरातिथ्य,"एक प्रकार की शराब जो गन्ने के रस, चावल और म",पाहुण्याचा केलेला आदरसन्मान ,258.41,4.32,44,1262,52,37,25,43,0
user2,351,351,मोरध्वज,रास,द्वापर युग के एक राजा जिनकी भक्ति की परीक,खळ्यातील धान्याचा ढीग रास गोण,261.34,4.29,41,544,52,29,29,41,0
user2,353,353,हत्यारा,हत्यारा,वह जिसने किसी को जान से मारा हो या मारता हो,खून करणारी व्यक्ती न्यायाधीश,302.54,3.84,26,698,106,28,13,25,1
user2,355,355,प्रधानता,प्राधान्य,श्रेष्ठ या मुख्य होने की अवस्था या भाव ,सर्वात श्रेष्ठ किंवा प्रमुख असण्याचा अव,227.18,3.79,38,444,62,41,26,38,1
user2,357,357,जल भंडारण,आझाद हिंद सेना,वह मानवकृति जहाँ जल का भंडारण या जल को इकट,राजा महेन्द्र प्रताप सिंह ह्यांनी एकोणत,431.0,10.87,8,1410,161,58,4,7,0
