user2,1,1,ग्वारानी,स्प्रिंग,पराग्वे तथा बोलीविया में बोली जाने वाली भ,"धातूची लवचिक, दबणारी किंवा दाबून किंवा ओढ",249.25,8.6,28,862,33,35,13,28,0
user2,3,3,कुंडी,पन्ह,मिट्टी या पत्थर का एक बरतन जो कटोरे के आका,"उकडलेल्या कैरीच्या बलकात साखर, मीठ व पाणी",281.93,3.83,226,876,49,37,177,225,0
user2,5,5,प्रभावकारी,प्रभावशाली,अपना काम या प्रभाव दिखलानेवाला यह सर्द,आपले काम किंवा प्रभाव दाखवणारा,256.15,3.33,68,1483,34,23,40,67,1
user2,7,7,टंकी,टाकी,किसी वाहन में बना वह पात्र जिसमें ईंधन आद,एखाद्या वाहनात इंधन इत्यादि भरलेले धातू,264.44,3.55,45,506,71,37,41,44,1
user2,9,9,आवाहन,आवाहन,किसी काम में साथ देने के लिए बुलाने या आओ क,एखाद्या कामात साथ देण्यासाठी बोलवण्याची,278.71,4.39,124,1052,32,43,97,123,1
user2,11,11,दुश्मन,दुम्मान,वह जिससे शत्रुता या वैर हो दुश्मन और आग ,ज्याच्याशी वैर आहे असा मनुष्य,260.6,4.29,58,924,83,26,47,57,1
user2,13,13,विकलांगता,दारुड्या,विकलांग होने की अवस्था या भाव  परिश्रमि,दारु प्यायलेला माणूस तो दारुड,237.05,4.78,62,461,44,26,45,62,0
user2,15,15,कोमलांगना,कोमलांगी,कोमल अंगोंवाली या जिसके अंग कोमल हों सड,जिचे अंग कोमल आहे अशी परिस्थि,280.36,3.94,140,908,51,32,94,139,1
user2,17,17,दोली,डोली,एक प्रकार की सवारी जो कहार कंधे पर लेकर चल,"अशक्त, आजारी, स्त्री, पुरुष, वृद्ध यांना ने",265.09,6.46,116,598,48,37,99,115,1
user2,19,19,आवासी,रहवासी,किसी जगह पर रहने या बसने वाला जीव जंगल क,एखाद्या ठिकाणी राहणारा किंवा निवास करणा,251.41,4.52,112,619,34,37,94,112,1
user2,21,21,तटवासी,तीरवासी,तट पर रहनेवाला बाढ़ के कारण अधिकाँश तटव,किनार्यावर किंवा तीरावर राहत असलेला,246.31,3.61,26,441,101,25,22,25,1
user2,23,23,परमल,परिमल,अच्छी गन्ध या महक फूलों की परमल सारे बग,चांगला वास रातराणीचा परिमल दर,230.19,4.62,31,481,27,21,25,31,1
user2,25,25,द्रुमिल,ट्रॅफिक जॅम,एक ऋषि द्रुमिल का वर्णन पुराणों में मिल,एका विशिष्ट कालावधीत एका विशिष्ट क्षेत्,275.9,4.07,108,669,40,39,96,108,0
user2,27,27,साँवला,सावळा,कुछ कुछ काला या हल्का काला कृष्ण साँवले,काळ्या रंगाकडे झुकलेल्या रंगाचा,271.46,4.24,26,575,88,17,19,25,1
user2,29,29,तबदीली,बदली,अधिकारी या कार्यकर्ता का एक स्थान या विभा,दुसर्या ठिकाणी नेमणूक माझी रत,236.14,4.88,37,538,55,39,42,36,1
user2,31,31,नागरंग,नारंगी,नीबू की जाति का एक मझोले आकार का पेड़ ना,लिंबाच्या जातीचे एक झाड नागपु,229.56,4.99,36,475,28,30,30,35,1
user2,33,33,जितना,जितका,जिस मात्रा या परिणाम का मैं आपसे जितना ,प्रमाणवाचक शब्द तुला जितक चाल,251.6,4.26,40,392,71,23,33,39,1
user2,35,35,अमान्यकरण,अधिसूचना,अमान्य करने की क्रिया या भाव फर्जी दस्त,अधिकृत सूचना मंत्रालयातून आल,251.46,4.9,105,508,39,25,79,104,0
user2,37,37,परसादी,प्रसाद,वह खाने या पीने की वस्तु जो देवता को चढ़ाई,देवाला चढवलेले खाण्यापिण्याचे पदार्थ,259.96,3.17,49,718,64,32,39,49,1
user2,39,39,बुर्ज,बुरूज,किले की दीवार में थोड़ी दूर पर त्रिकोणाका,"कोटाच्या तटबंदीत मजबुतीसाठी, बचावासाठी ",194.74,5.22,38,352,53,37,31,37,1
user2,41,41,नाटकीयता,नाटकीपणा,नाटकीय होने की क्रिया या अवस्था जयश्री,नाटकी असण्याची क्रिया किंवा अवस्था,227.4,3.92,63,546,32,40,56,62,1
user2,43,43,पालतू पक्षी,क्षमावंत,वह पक्षी जो पाला जाता हो मुर्गा एक पालत,क्षमा करणारा क्षमावंत व्यक्त,248.45,3.22,38,692,38,21,21,37,0
user2,45,45,दूरी,लाल मनुका,दूर होने की अवस्था या भाव लड़ाई झगड़े क,लाल रंगाचा मनुका लाल मनुका पा,230.56,3.43,36,417,26,34,30,35,0
user2,47,47,ध्वनि,नराधम,वह जो सुनाई दे एक तीव्र ध्वनि ने उसकी एक,माणूस असूनही राक्षसासारखा वागणारा माणूस,253.61,4.52,31,788,123,27,25,30,0
user2,49,49,कुकृत्य,अपकृत्य,बुरा कर्म या वह कर्म जिसे करना बुरा हो त,दुष्टपणाचे कृत्य सर्वांना आप,245.84,2.94,31,530,29,26,21,30,1
user2,51,51,रायबरेली,महिरपीच्या मध्यभागीची वीट,भारत के उत्तर प्रदेश राज्य का एक शहर सो,महिरपीच्या मध्यभागीची वीट मु,261.75,3.76,40,604,75,29,33,40,0
user2,53,53,पश्चिम सिक्किम,गाभा,भारत के सिक्किम राज्य का एक जिला पश्चिम,"देवळाच्या आतील, ज्यात मूर्ती असते तो भाग",279.93,3.67,44,760,49,32,37,43,0
user2,55,55,अश्लीलता,बारामाशी,अश्लील होने की अवस्था या भाव अश्लीलता क,वर्षाच्या सगळ्या महिन्यांत येणारा किंवा,229.02,2.8,40,612,31,31,32,39,0
user2,57,57,चातुर्मास,उड्डाण,चतुर्मास का या चतुर्मास में होने वाला ग,विमान इत्यादींना उडविण्याची क्रिया,261.42,2.99,31,453,52,25,20,31,0
user2,59,59,समद्विबाहु,200,जिसकी दो भुजाएँ समान हों  एक समद्विबाहु,शंभर आणि शंभर मागच्या वेळी दो,270.38,3.57,45,703,22,21,28,44,0
user2,61,61,गुरिल्ला सेना,पुढे जाणारा,गोरिल्ला युद्ध करने वाली सेना शिवाजी क,पुढे जाण्याची क्रिया करणारा प,252.06,4.09,36,603,54,29,24,36,0
user2,63,63,गौरक्षा,गोरक्षण,गाय की रक्षा करने का काम वे गोरक्षा को अ,गायीचे रक्षण करण्याचे काम ते ,233.5,3.69,26,483,24,26,18,25,1
user2,65,65,जीव मंडल,ग्रीनलँडिक,पृथ्वी की सतह और वातावरण का क्षेत्र संप,ग्रीनलँडिक भाषाचा वा त्याच्याशी संबंधित,240.47,3.63,43,430,108,35,39,42,0
user2,67,67,विषम,कोक्राझार,जो दो से भाग देने पर पूरी पूरी न बँट सके सं,भारताच्या आसाम राज्यातील एक जिल्हा,254.79,3.05,38,757,110,34,33,38,0
user2,69,69,खूनी,सुजाता,खून संबंधी या खून का खूनी रिश्तों में स,उद्दालक ऋषींची पुत्री जिचा विवाह कहोडसो,254.12,3.96,57,846,21,27,43,56,0
user2,71,71,संक्षेपण,संक्षेप,संक्षिप्त करने की क्रिया  प्रस्तुत लेख,संक्षिप्त करण्याची क्रिया दि,281.62,5.25,39,840,104,26,29,38,1
user2,73,73,विद्रूप,विद्रूप,जिसमें किसी प्रकार का विकार हो गया हो  अ,ज्यात विकार किंवा बिघाड झाला आहे असा,224.87,4.22,39,426,53,36,36,39,1
user2,75,75,मदनचतुर्दशी,स्वादुपिंड,चैत्र मास के शुक्ल पक्ष की चतुर्दशी कल ,पोटाच्या मागाच्या बाजूला असलेली ग्रंथी,250.23,4.02,71,723,35,24,49,71,0
user2,77,77,सिंधव,सिंधी,"सिंध प्रदेश का या वहाँ के निवासी, भाषा, संस",सिंध प्रांताचा त्याला सिंधी भ,226.34,3.3,59,460,49,36,52,58,1
user2,79,79,जांबू,जांभूळ,एक सदाबहार पेड़ जिसके फल बैंगनी या काले ह,जांभळ्या रंगाची फळे येणारे सदाहरित झाड,210.12,3.62,32,372,63,30,28,31,1
user2,81,81,प्रेषण,भोपळा,कहीं कुछ या किसी को भेजने या रवाना करने की,क्रिकेट ज्यात एक ही धाव झाली नाही अशी स्थ,233.0,3.56,47,610,9,37,39,47,0
user2,83,83,पलंगपोश,पलंगपोस,पलंग आदि पर सबसे ऊपर बिछाने की चादर पलं,पलंग इत्यादीवर अंथरले जाणारे वस्त्र,276.23,3.23,35,606,86,28,28,34,1
user2,85,85,बाँझ,प्रार्थना,स्त्री या मादा पशु जिसे संतान होती ही न ह,एखाद्यास एखादी गोष्ट करण्यासाठी नम्रपणे,283.59,3.71,106,1398,28,38,68,105,0
user2,87,87,सुनाभ,अंगी,गरुड़ का एक पुत्र सुनाभ का वर्णन पुराणो,अनेक अवयव मिळून झालेला विशिष्ट पदार्थ,292.39,4.14,71,1235,117,28,54,70,0
user2,89,89,नागपुरी,पणत,एक प्रकार की भैंस जिसके सींग लंबे होते है,नातवाचा मुलगा माझा पणतू चार व,228.95,2.88,38,417,62,31,32,37,0
user2,91,91,प्राणिमात्र,प्राणिजात,सभी सजीव सृष्टि स्वतंत्रता और स्वाधीन,सर्व सजीव सृष्टी प्रदूषणामुळ,241.15,3.72,61,502,70,23,42,60,1
user2,93,93,इच्छा,इच्छा,वह मनोवृत्ति जो किसी बात या वस्तु की प्रा,ज्यामुळे एखाद्या गोष्टीच्या प्राप्तिकड,245.38,4.07,56,518,30,39,50,55,1
user2,95,95,कल्पतरु,कल्पद्रुम,हिंदू धर्मग्रंथों में वर्णित वह वृक्ष जो,"एक काल्पनिक वृक्ष, आपण कल्पिलेली कोणतीही",223.82,3.11,51,532,81,49,40,50,1
user2,97,97,माया,चेटक्या,इंद्रवज्रा नामक वर्णवृत्त का एक उपभेद जो,"जादूटोणा,मंत्रतंत्र,करणी करणारा",251.76,3.6,75,805,39,37,70,74,0
user2,99,99,तृषा,तृष्णा,पानी पीने की इच्छा अपनी तृषा बुझाने के ,पाणी पिण्याची इच्छा मला खूप त,229.38,3.6,21,695,46,23,17,20,1
user2,101,101,अन्वर्थ,अन्वर्थक,अर्थ के अनुकूल यह व्याख्या अन्वर्थ नही,अर्थाला अनुसरणारा ही व्याख्य,334.06,3.4,90,1455,99,16,48,90,1
user2,103,103,राजसमन्द,मेंदी,कुंभलगढ़ के रास्ते पर स्थित एक विशाल झील ,ज्याच्या पाल्यात कात चुना घालून स्त्रिय,218.52,3.78,44,413,43,50,40,43,0
user2,105,105,रंगाई,रंगकाम,रंगने की क्रिया या भाव एक कमरे की रँगाई ,रंगण्याचे काम घराच्या रंगकाम,252.23,3.08,31,537,77,25,25,31,1
user2,107,107,दुःखद,दुःखमय,जो दुख से भरा हो हिंदू विधवा का जीवन दुः,दुःखाने भरलेला त्याच्या दुःख,259.67,4.49,36,516,112,23,28,36,1
user2,109,109,ख़रीफ़,अहमदाबाद,आषाढ़ से अगहन तक में काटी जाने वाली फ़सल,गुजरात राज्यातील एक शहर अहमदा,218.34,3.77,47,455,33,31,37,47,0
user2,111,111,नीचा,बेल्जियमी,जिसके तल से उसके आसपास का तल ऊँचा हो या जो ,बेल्जियमी भाषेचा किंवा बेल्जियमी भाषेशी,243.83,3.59,36,396,112,39,36,36,0
user2,113,113,वैधानिक,तक्रार,संविधान या किसी संस्था के नियमों से संबंध,न्यायासाठी केलेली प्रार्थना ,247.45,3.44,62,634,29,32,47,61,0
user2,115,115,आह्वान,भूलभुलैय्या,किसी काम में साथ देने के लिए बुलाने या आओ क,ज्यात एकदा शिरले की बाहेर कसे पडावे हे कळ,233.22,3.03,46,1218,42,46,33,45,0
user2,117,117,पंजर,पिंजरा,"लोहे, बाँस आदि की तीलियों का बना हुआ वह झाब","पंजर,पिंजरा,""  लोहे, बाँस आदि की तीलियों का ब"" ",228.68,5.53,38,444,75,64,43,37,1
user2,119,119,असबर्ग,आरुणी,एक फूल जो एक प्रकार की लंबी घास से प्राप्त,धौम्य ऋषींचे एका शिष्य आरुणील,265.56,3.06,43,884,26,35,32,42,0
user2,121,121,निद्राग्रस्त,निद्राक्रांत,जिसे नींद आ रही हो या जिसकी आँखें नींद से भ,ज्याला झोप येत आहे असा सीता आप,208.53,3.23,34,455,36,36,27,33,1
user2,123,123,रैयत,रयत,किसी राजा के अधीन या उसके राज्य में रहने व,एखाद्या राजा वा शासनाच्या आधिपत्याखाली ,204.8,4.8,25,357,102,37,23,24,1
user2,125,125,तरीदार,रसदार,जिसमें शोरबा या रस हो पूड़ी के साथ तरीद,ज्यात रस्सा आहे असा पुरीबरोबर,261.58,3.51,31,784,65,31,24,30,1
user2,127,127,जमापूँजी,गंगानगर,इकठ्ठा या जमा किया हुआ धन उसकी सारी जमा,भारतातील राजस्थान राज्यातील एक जिल्हा,213.3,4.52,20,365,36,24,16,20,0
user2,129,129,सत्ताधीश,सत्ताधारी,वह जिसके हाथ में सत्ता हो अंग्रेज सत्ता,"सत्ता, मालकी, प्रभुत्व वगैरे असलेला मनुष्",196.19,6.69,16,344,43,32,14,15,1
user2,131,131,चाल,चाळ,अनेक परिवारों के रहने के लिए बनाई गई आपस म,एकाच नमुन्याच्या घरांची पट्टी,183.0,3.76,32,365,49,41,26,31,1
user2,133,133,विनती,विनवणी,किसी से कुछ करने के लिए नम्रतापूर्वक कहने,एखाद्यास एखादी गोष्ट करण्यासाठी नम्रपणे,201.12,4.59,24,366,74,36,20,24,1
user2,135,135,ईंदर,इंडिया गेट,एक प्रकार की मिठाई ईंदर ताजा ब्याई हुई ,दिल्लीतील एक राष्ट्रीय स्मारक,251.83,3.13,30,866,22,29,20,29,0
user2,137,137,मिलान,मिलाफ,मिलने की क्रिया या भाव नाटक की समाप्ति ,एकत्र येण्याची क्रिया नाटकाच,215.05,6.86,22,419,116,27,17,21,1
user2,139,139,दरियाई नारियल,पन्नासेक,एक प्रकार का बड़ा नारियल दरियाई नारियल,लगभग पचास त्याच्या कुटुंबात प,286.59,3.2,32,761,52,21,20,32,0
user2,141,141,सेंधमार,चिलीम,सेंध लगाकर चोरी करने वाला पहले ज़माने म,तंबाखूचा धूर ओढण्याची नळी असललेले माती क,251.72,4.68,43,546,17,28,33,42,0
user2,143,143,अभोक्ता,मादागास्कर,व्यवहार या काम में न लाने वाला ग्रामीण ,आफ्रिका खंडाच्या आग्नेयास असलेले लोकशाह,251.98,3.5,65,874,24,39,54,64,0
user2,145,145,आत्माभिमान,स्वाभिमान,अपनी प्रतिष्ठा या अभिमान महाराणा प्रत,स्वतःचा अभिमान प्रत्येक माणस,285.42,4.36,45,940,61,21,32,44,1
user2,147,147,कटोरदान,कर्णवेध संस्कार,वह ढक्कनदार बर्तन जिसमें भोजन आदि रखते है,लहान मुलाचे कान टोचण्याचा एक विधी सोळासं,287.26,4.15,38,821,56,35,26,37,0
user2,149,149,फुहारा,फवारा,वह मानवकृति जिसमें से ऊपरी दबाव के कारण ज,पाणी उंच उडवण्याचे साधन म्हैस,229.0,4.87,38,440,90,46,34,37,1
user2,151,151,परदेसी,परदेशी,जो दूसरे देश का रहनेवाला हो या दूसरे देश म,दुसर्या देशात राहणारा परदेशी,205.07,5.79,14,401,30,33,11,13,1
user2,153,153,दिग्भ्रमित,हस्ताक्षरतज्ञ,जो सही दिशा में नहीं जा रहा हो दिग्भ्रम,एखादे हस्तक्षर अभ्यासून ते एखाद्या विशि,267.95,4.79,44,791,56,39,23,43,0
user2,155,155,खुरचन,जागतिक विक्रम,एक प्रकार की मिठाई  श्यामा खुरचन खा रही ,जागतिक स्तरावर एखाद्या क्षेत्रात केलेले,280.4,4.77,30,526,49,44,26,29,0
user2,157,157,जुवार,ज्वारी,एक प्रकार का पौधा जिसके दाने अनाज के रूप म,एक धान्याचे रोप शेतात यंदा ज्,245.48,3.88,31,581,63,29,23,30,1
user2,159,159,अभिपूर्ण,परिपूर्ण,जो पूरी तरह से पूर्ण या भरा हुआ हो या जिसमे,पूर्णपणे भरलेला किंवा कसलीही कमतरता नसल,257.69,3.43,61,721,44,35,49,60,1
user2,161,161,छोर,सदरा,अधिक लंबी और कम चौड़ी वस्तु के वे दोनों सि,"आर्धी बाही वा पूर्ण बाह्यांचा, कंबरे पर्य",308.5,1.39,14,593,131,44,12,14,0
user2,163,163,ग्राहकगण,सक्तमजुरी,सामूहिक रूप से ग्राहक का वर्ग इस दुकानद,एखाद्या गुन्ह्याबद्दल गुन्हेगारास तुरु,216.36,3.38,59,526,49,29,33,59,0
user2,165,165,वैभिन्य,वैविध्य,अनेक प्रकार की बातों आदि से युक्त होने की ,अनेक प्रकारच्या गोष्टी इत्यादींनी युक्त,235.84,4.08,31,531,29,29,23,31,1
user2,167,167,लेह,आवळा,भारत के जम्मू और कश्मीर प्रांत का एक जिला,बाहेरून सहा उभ्या रेषा असलेले एक तुरट फळ,204.06,5.16,18,472,81,34,13,17,0
user2,169,169,किसमिस,खिसमिस,सुखाया हुआ छोटा बेदाना अंगूर माधविका क,द्राक्ष वाळवून तयार झालेला सुका मेवा,263.44,3.17,25,599,46,23,14,24,1
user2,171,171,संरक्षण,सुरक्षा,अच्छी तरह की जाने वाली रक्षा यह देश आभा,"व्यवस्थितपणे राखणे, संभाळ करण्याची क्रि",234.91,3.37,22,546,39,40,14,21,1
user2,173,173,अपमान,अवमान,वह बात या कार्य जिससे किसी का मान या प्रति,"एखाद्याचा मान, प्रतिष्ठा भंग करणारी गोष्",228.32,3.86,37,516,83,36,29,36,1
user2,175,175,अमाननीय,अमान्य,"जिसे ठीक, नियमित या विहित न होने के कारण न ",मानण्यास योग्य नसलेला मला ह्य,490.8,3.74,5,1323,47,38,0,5,1
user2,177,177,हफ्ता,हप्ता,सात दिनों की अवधि मैं एक सप्ताह में वाप,सात दिवसांचा कालावधी मी मागचा,233.39,5.93,18,373,87,22,13,17,1
